<?xml version="1.0" encoding="UTF-8"?>
<!--
  Copyright 1999-2004 The Apache Software Foundation

  Licensed under the Apache License, Version 2.0 (the "License");
  you may not use this file except in compliance with the License.
  You may obtain a copy of the License at

      http://www.apache.org/licenses/LICENSE-2.0

  Unless required by applicable law or agreed to in writing, software
  distributed under the License is distributed on an "AS IS" BASIS,
  WITHOUT WARRANTIES OR CONDITIONS OF ANY KIND, either express or implied.
  See the License for the specific language governing permissions and
  limitations under the License.
-->
<!DOCTYPE book PUBLIC "-//APACHE//DTD Cocoon Documentation Book V1.0//EN" "book-cocoon-v10.dtd">
<book software="Apache Cocoon" 
      title="Apache Cocoon Installation Documentation" 
      copyright="@year@ The Apache Software Foundation">

  <menu label="Navigation">
    <menu-item label="Main" href="../index.html"/>
  </menu>

  <menu label="Installation">
    <external  label="Download" href="http://cocoon.apache.org/mirror.cgi"/>

    <menu-item label="Intro" href="index.html"/>
    <menu-item label="Requirements" href="requirements.html"/>
    <menu-item label="Updating" href="updating.html"/>
    <menu-item label="Jars" href="jars.html"/>
  </menu>

  <menu label="Testing">
    <menu-item label="Overview" href="tests.html"/>
  </menu>

</book>
