<?xml version="1.0"?>
<!DOCTYPE book PUBLIC "-//APACHE//DTD Cocoon Documentation Book V1.0//EN" "../../dtd/book-cocoon-v10.dtd">

<book software="Apache Cocoon" 
      title="Apache Cocoon XSP"
      copyright="@year@ The Apache Software Foundation">

  <menu label="Navigation">
    <menu-item label="Main" href="../../index.html"/>
    <menu-item label="User Documentation" href="../index.html"/>
  </menu>

  <menu label="XSP">
    <menu-item label="Overview" href="index.html"/>
    <menu-item label="XSP Guide" href="logicsheet.html"/>
    <menu-item label="XSP Internals" href="xsp-internals.html"/>
    <menu-item label="XSP Logicsheets" href="logicsheet-concepts.html"/>
    <menu-item label="Sessions" href="sessions.html"/>
  </menu>

  <menu label="Logicsheets">
    <menu-item label="Request" href="request.html"/>
    <menu-item label="Session" href="session.html"/>
    <menu-item label="ESQL" href="esql.html"/>
    <menu-item label="Forms" href="logicsheet-forms.html"/>
    <menu-item label="Sendmail" href="sendmail.html"/>
  </menu>

</book>


